レベル1,レベル2,レベル3,レベル4,フィールド,フィールド詳細
ギャンブルは元が取れれば、ありがたいものです。,博打は元がとれりゃあ、御の字でさぁ。,博打は元が取れれば、御の字ですよ。,博打は元がとれりゃあ、御の字だよ。,言葉,啖呵
うまく回りましたら、ご喝采いただけますと幸いです。,うまく回りましたら、ご喝采！,うまく回ったら、ご喝采ですよ。,うまく回ったら、ご喝采！,言葉,啖呵
さあ、ただいま戻りました。,お～い、ご主人様のご帰還だぞぅ。,さあ、ただいま戻りました。,ただいま。,言葉,啖呵
本当ですか、にわかには信じられません。,ご冗談でしょ、お日さんが西から昇らあ。,冗談でしょ、それが本当なら太陽が西から昇りますよ。,冗談でしょ、それが本当なら太陽が西から昇るよ。,言葉,啖呵
ご存じありませんでしたか、あまりご縁のないことでいらっしゃるようですからね。,うかつだねぇ、芋の煮えたもご存じない。,うかつでしたね、ちょっと世間知らずですよ。,うかつだね、芋の煮えたもご存じないのかい。,言葉,啖呵
お静かに、お話はここまでにいたしましょう。,うるせえな、何だかんだとご託を並べやがって。,うるさいですね、何だかんだとご託を並べないでください。,うるさいな、何だかんだとご託を並べないで。,言葉,啖呵
おや？仲睦まじくていらっしゃいますね、ご馳走様です。,あれ？お惚気ですかい、ご馳走様。,あれ、惚気ですか、ご馳走様です。,あれ？惚気かな、ご馳走様。,言葉,啖呵
何とも大変でいらっしゃいますね。,何ともご苦労なこった！,何とも大変ですね。,何ともご苦労なことだね。,言葉,啖呵
ご注進、ご注進と、掛け声だけは立派なんですよ、あの方は。,ご注進、ご注進って、掛け声だけなんだ、あいつは。,ご注進、ご注進って、掛け声だけなんですよ、あの人は。,ご注進、ご注進って、掛け声だけなんだ、あいつは。,言葉,啖呵
あまり縁起ばかりを気になさるのもいかがかと存じます。,ご幣を担ぐのも大概にしろよ。,ご幣を担ぐのもほどほどにしましょうよ。,ご幣を担ぐのも大概にしろよ。,言葉,啖呵
やり方はさまざまございますので、仕上がりでご判断いただけると幸いです。,細工は流々、仕上げをご覧じろ。,やり方はいろいろあるので、出来上がりで判断してもらえますか。,やり方に口を挟まないで、出来上がりで判断して。,言葉,啖呵
過分なお言葉、恐縮でございます。,歯の浮くようなほめ言葉、まっぴらごめんです。,お世辞は結構です。,お世辞はいらないよ。,言葉,啖呵
生憎ですが、食事を済ませたばかりでございまして。,生憎、食事を済ませたばかりでして。,生憎、食事を済ませたばかりなんです。,生憎、食事を済ませたばかりでね。,断る,
保証期間後の交換は、致しかねます。,保証期間後の交換は、致しかねます。,保証期間後の交換は、できません。,保証期間後の交換は、できないよ。,断る,
どうぞお帰りください。マンションの建設には断固反対いたします。,どうぞお帰りください。マンションの建設には絶対反対です。,どうぞ帰ってください。マンションの建設には絶対反対です。,どうぞ帰って。マンションの建設には絶対反対だ。,断る,
せっかくでございますが、ご遠慮させていただきます。／固くお断りいたします。,せっかくですが、お断りします。／固くお断りいたします。,せっかくですが、お断りします。／固くお断りします。,せっかくだけど、断るよ。／固く断るよ。,断る,
ご参加が難しいのであれば、お断りになればよろしいかと存じます。,行きたくないんだったら、お断りになればいいじゃないの。,行きたくないんだったら、お断りすればいいじゃないですか。,行きたくないんだったら、断ればいいのに。,断る,
残念ではございますが、お力添えいたしかねます、ご了承くださいませ。,残念ですが、お力になれません、悪しからず。,残念ですが、力になれません、悪しからず。,残念だけど、力になれないよ、ごめんね。,断る,
本日のところは、どうぞお引き取りくださいますようお願いいたします。,今日のところは、どうぞお引き取りください。,今日のところは、どうぞ帰ってください。,今日のところは、どうか帰って。,断る,
この度は、お役に立てず、遺憾でございます。,この度は、お役に立てなくて残念です。,今回は、お役に立てなくて残念です。,今回は、役に立てなくて残念だ,断る,
残念ですが、今回はご希望に添いかねます。,残念ですが、今回はご希望に添いかねます。,残念ですが、今回は希望に添えません。,残念だけど、今回は希望に添えないよ。,断る,
以後のお取引は、ご遠慮申し上げます。,以後のお取引は、ご遠慮申し上げます。,以後の取引は、遠慮します。,これからの取引は、できないよ。,断る,
そのような業務につきましては、対応いたしかねます。,そういう仕事は、ごめんこうむります。,そういう仕事は、ごめんこうむります。,そういう仕事は、ごめんこうむるよ。,断る,
その件につきましては、生憎ですがご辞退申し上げます。,その件については、はっきりご辞退申しあげます。,その件については、はっきり辞退します。,その件については、はっきり辞退する。,断る,
あのようなよい話を辞退なさるとは、惜しいことをなさいます。,あんないい話を辞退なさるなんて、もったいない！,あんないい話を辞退するなんて、もったいないですね。,あんないい話を辞退するなんてもったいない！,断る,
先生は、特別扱いを固辞なさいました。,先生は、特別扱いを固辞なさいました。,先生は、特別扱いを固辞しました。,先生は特別扱いを固辞した。,断る,
ありがたいお話をありがとうございます。身に沁みました。,お説教はもう結構です。,お説教はもういいです。,お説教はもういいよ。,断る,
こちらの槍ヶ岳はどちらの辺りからお描きになられましたのでしょうか？,この槍ヶ岳は、どのあたりからお描きになったんですか？,この槍ヶ岳はどの辺りから描きましたか？,この槍ヶ岳はどの辺から描いたの？,作品,
こちらの方が表紙の絵を描かれる画伯でいらっしゃいます。,こちらが表紙の絵を描かれる画伯です。,こちらが表紙の絵を描かれる画伯です。,この方が表紙の絵を描かれる画伯だよ。,作品,
先生のお作を、いつも楽しく拝見しております。,先生のお作を、いつも楽しく拝見しております。,先生の作品を、いつも楽しく見せていただいています。,先生の作品は、いつも楽しくみせてもらってるよ。,作品,
この百号は、画伯が一年をかけたご労作でございます。,この百号は、画伯が一年をかけたご労作です。,この百号は、画伯が一年をかけたご労作です。,この百号は、画伯が一年をかけた労作だよ。,作品,
春までには、ぐい呑みをお作りいたします。,春までには、ぐい呑みをお作りいたします。,春までには、ぐい呑みを作ります。,春までには、ぐい呑みを作るよ。,作品,
今度の応援歌、先生がお作りになったのですね。,今度の応援歌、先生がお作りになったんですね。,今度の応援歌、先生が作ったんですね。,今度の応援歌、先生が作ったんだってね。,作品,
街のイラストマップをお作りになったのですって？,街のイラストマップを作られたんですって？,街のイラストマップを作られたんですって？,街のイラストマップを作ったんだって？,作品,
ついに、ご新居がご完成！　おめでとうございます。,ついに、新居がご完成！　おめでとうございます。,ついに、新居がご成！　おめでとうございます。,ついに、新居がご完成！　おめでとう！,作品,
ついに、念願の一号機が完成なさいましたね。,ついに、念願の一号機が完成なさいましたね。,ついに、念願の一号機が完成しましたね。,ついに、念願の一号機が完成したね。,作品,
肌つやもぴかぴかで、見事なお仕上がりですね、先生！,肌つやもぴかぴかで、見事なお仕上がりですね、先生！,肌つやもぴかぴかで、見事な仕上がりですね、先生！,肌つやもぴかぴかで、いい仕上がりだね、先生！,作品,
お写真だけでもご覧になっていただけませんか？,お写真だけでもご覧になっていただけませんか？,写真だけでも見ていただけませんか？,写真だけでも見てもらえない？,作品,
お宮参りのお写真をお写しになったのですね。,お宮参りの写真をお写しになったのですね。,お宮参りの写真を移したんですね。,お宮参りの写真を写したんだね。,作品,
皆さんお並びください。私がお撮りしましょう。,皆さん並んでください。私がお撮りしましょう。,皆さん並んでください。私が撮りしましょう。,並んでよ。私が撮るよ。,作品,
桜を追いかけて、お撮りになっているんですか？,桜を追いかけて、お撮りになっているんですか？,桜を追いかけて、撮っているんですか？,桜を追いかけて、撮っているの？,作品,
三十年かけてインドの祭りを撮影なさったとか…。,三十年かけてインドの祭りを撮影なさったとか…。,三十年かけてインドの祭りを撮影したとか…。,三十年かけてインドの祭りを撮影したとか…。,作品,
小犬にかまれたくらいでお訴えになるのは、どうかと思いますよ。,小犬にかまれたくらいでお訴えになるのは、どうかと思いますよ。,小犬にかまれたくらいで訴えるのは、どうかと思いますよ。,小犬にかまれたくらいで訴えるのは、どうかと思うよ。,裁く,裁判
部長は、けんか両成敗でお裁きになりました。,部長は、けんか両成敗でお裁きになりました。,部長は、けんか両成敗で裁いた。,部長は、けんか両成敗で裁いた。,裁く,裁判
ここまで来たら、会長さんにご裁断を仰ぐしかありませんな。,ここまで来たら、会長さんにご裁断を仰ぐしかありませんな。,ここまで来たら、会長さんに決めてもらうしかありませんな。,ここまで来たら、会長さんに決めてもらうしかないね。,裁く,裁判
社長、見事なご裁決でした。,社長、見事なご裁決でした。,社長、見事なご決定でした。,社長、見事な決定だった。,裁く,裁判
裁決なさるのは、あの名判事でございますね。,裁決なさるのは、あの名判事ですね。,裁決するのは、あの名判事ですね。,決めるのは、あの名判事だね。,裁く,裁判
そんなにもめるのであれば、採決なさったらいかがですか？,そんなにもめるんなら、採決なさったらいかがですか？,そんなにもめるなら、決めたらどうですか？,そんなにもめるんなら、決めたらどう？,裁く,裁判
覚悟はしております。どうかご裁定を下していただきたい。,覚悟はしております。どうかご裁定を下していただきたい。,覚悟はしています。どうかご裁定を下してもらいたい。,覚悟はしてます。どうか決めてもらいたい。,裁く,裁判
こじれた仲を裁定なさるのは、容易ではないでしょうね。,こじれた仲を裁定なさるのは、容易じゃないでしょうね。,こじれた仲を裁定するのは、容易じゃないでしょうね。,こじれた仲を裁定するのは、簡単じゃないだろうね。,裁く,裁判
この件は、先生のご裁量に任された方がよろしいのでは？,この件は、先生のご裁量に任された方がよろしいのでは？,この件は、先生の裁量に任せた方がいいのでは？,このことは、先生に決めてもらった方がいいんじゃ？,裁く,裁判
皆さんが納得する公平なご処置を、お願いいたします。,皆さんが納得する公平なご処置を、お願いいたします。,皆さんが納得する公平な処置を、お願いします。,皆が納得する公平な処置を、お願いするよ。,裁く,裁判
寛大なるご処分に感謝申し上げます。,寛大なるご処分に感謝いたします。,寛大なる処分に感謝します。,寛大なる処分に感謝します。,裁く,裁判
裁判長のご判決は、社会に不満を残されましたね。,裁判長のご判決は、社会に不満を残しましたね。,裁判長の判決は、社会に不満を残しましたね。,裁判長の判決は、社会に不満を残したね。,裁く,裁判
合併に関して、社長が最後のご決断を下されました。,合併に関して、社長が最後のご決断を下されました。,合併に関して、社長が最後の決断を下しました。,合併に関して、社長が最後の決断を下した。,裁く,裁判
何かあったのでしょうか、突然告訴をお取り下げになるなんて。,何かあったのかしら、突然告訴をお取り下げになるなんて。,何かあったのかしら、突然告訴を取り下げるなんて。,何かあったのかな、突然告訴を取り下げるなんて。,裁く,裁判
あの方の無罪は、どこから見てもご明白ですよ。,あの方の無罪は、どこから見てもご明白ですよ。,あの方の無罪は、どこから見ても明白ですよ。,あの方の無罪は、どこから見てもはっきりしているよ,裁く,裁判
難しいお立場にいらっしゃるのですね、お気の毒に。,難しいお立場にいらっしゃるんですね、お気の毒に。,難しいお立場にいるんですね、お気の毒に。,難しいお立場にいるんだね、気の毒に。,自覚,
きつい言葉は、お慎みになった方がよろしいのでは？,きつい言葉は、お慎みになった方がよろしいのでは？,きつい言葉は、慎んだ方がいいのでは？,きつい言葉は、慎んだ方がいいんじゃ？,自覚,
ときには、お引きになる勇気もお持ちにならなくてはいけません。,ときには、お引きになる勇気も持たなくてはいけません。,ときには、引く勇気も持たなくてはいけません。,ときには、引く勇気も持たなきゃいけない。,自覚,
少しは常識というものを、おわきまえになってください。,少しは常識というものを、おわきまえになってください。,少しは常識というものを、わきまえてください。,少しは常識ってものを、わきまえなよ。,自覚,
今度ばかりは容赦しませんよ、覚悟なさってください！,今度ばかりは容赦しませんよ、覚悟なさい！,今度ばかりは容赦しませんよ、覚悟してください！,今度ばかりは容赦しないよ、覚悟しろよ！,自覚,
ここまできたら、観念なさることですね。,ここまできたら、観念なさることですね。,ここまできたら、観念することですね。,ここまできたら、観念することだよ。,自覚,
息子さんにも、ようやく親としてのご自覚が出ていらっしゃいましたか。,息子さんにも、ようやく親としてのご自覚が出てきましたか。,息子さんにも、ようやく親としての自覚が出てきましたか。,息子にも、ようやく親としての自覚が出てきたか。,自覚,
一児の親なのですから、ご自覚なさらないと。,一児の親なんですから、自覚なさらないと。,一児の親なんですから、自覚しなければ。,一児の親なんだから、自覚しないと。,自覚,
お怒りは存じますが、ここはひとつ、ご自制ください。,お怒りは分かりますが、ここはひとつ、ご自制ください。,お怒りは分かりますが、ここはひとつ、ご自制ください。,怒りは分かるけど、ここはひとつ、自制しな。,自覚,
この場は自制なさるのが、大人というものでございますよ。,この場は自制なさるのが、大人というものですよ。,この場は自制するのが、大人というものですよ。,この場は自制するのが、大人ってものだよ。,自覚,
そんなご分別もつかないようでは困ります。,そんなご分別もつかないようでは困ります。,そんな分別もつかないようでは困ります。,そんな分別もつかないようでは困る。,自覚,
過ちをくり返さないように、自戒なさるべきです。,過ちをくり返さないように、自戒なさるべきです。,過ちをくり返さないように、自戒するべきです。,過ちをくり返さないように、自戒するべきだ。,自覚,
もう少し、ご自分のお立場を認識なさってはいかがですか？,もう少し、ご自分の立場を認識なさってはいかがですか？,もう少し、自分の立場を認識してはいかがですか？,もう少し、自分の立場を認識してたらどう？,自覚,
課長さんも、今度こそは目がお覚めになったようですね。,課長さんも、今度こそは目がお覚めになったようですね。,課長さんも、今度こそは目が覚めたようですね。,課長さんも、今度こそは目が覚めたようだね。,自覚,
あの方には一度、お灸をすえてさしあげた方がよいと存じます。,あの人には一度、お灸をすえてあげた方がいいですよ。,あの人には一度、お灸をすえてあげた方がいいですよ。,あの人には一度、お灸をすえてやった方がいいよ。,叱る,
厳しいお叱り、真摯に受け止めます。,厳しいお叱り、真摯に受け止めます。,厳しいお叱り、誠意を持って受け止めます。,厳しいお叱り、真面目に受け止めます。,叱る,
お叱りになるのも、愛情だと思います。,お叱りになるのも、愛情だと思います。,叱るのも、愛情だと思います。,叱るのも、愛情だ。,叱る,
今の若い人は、忠告もお説教と受け取りますよ。,今の若い人は、忠告もお説教と受け取りますよ。,今の若い人は、忠告もお説教と受け取りますよ。,今の若い人は、忠告もお説教と受け取るよ。,叱る,
これ以上お責めになると、あの人の逃げ場がなくなるわ。,これ以上お責めになると、あの人逃げ場がなくなるわ。,これ以上責めると、あの人は逃げ場がなくなるわ。,これ以上責めると、あの人は逃げ場がなくなるわ。,叱る,
奥様がお咎めになるのも、もっともでございます。,奥様がお咎めになるのも、もっともです。,奥様が咎めるのも、もっともです。,奥様が咎めるのも、もっともだ。,叱る,
役人の居酒屋タクシーをもっと糾弾なさるべきです。,役人の居酒屋タクシーをもっと糾弾なさるべきです。,役人の居酒屋タクシーをもっと糾弾させるべきです。,役人の居酒屋タクシーをもっと糾弾させるべきだ。,叱る,
皆さんからのご詰問を受けまして、正直疲れました。,皆さんからのご詰問を受けまして、正直疲れました。,皆さんからの詰問を受けて、正直疲れました。,皆からの詰問を受けて、正直疲れた。,叱る,
これほどご譴責を受けるとは、思いもよらないことでございました。,これほどご譴責を受けるとは、思いもよらないことでした。,これほど譴責を受けるとは、思いもよらないことでした。,これほど譴責を受けるとは、思いもよらないことだった。,叱る,
久々にご叱正をいただき、目が覚めました,久々にご叱正をいただき、目が覚めました,久々に叱正をいただき、目が覚めました,久々に叱正され、目が覚めた。,叱る,
またまたきついご叱責をいただいてしまった。,またまたきついご叱責をいただいてしまった。,またきつい叱責をいただいてしまった。,またきつい叱責をされちゃった。,叱る,
先生が叱責なさる声が、びんびんと響いていました。,先生が叱責なさる声が、びんびんと響いていました。,先生が叱責なさる声が、びんびんと響いていた。,先生が叱責する声が、びんびんと響いていた。,叱る,
また姉からお小言を頂戴してしまいました。,またお姉さんからお小言を頂戴してしまったよ。,また姉から小言を言われてしまった。,また姉さんから小言を言われちゃった。,叱る,
お叱りをこうむるのは当然です、申し訳ございません。,お叱りをこうむるのは当然です、申し訳ございません。,お叱りを受けるのは当然です、申し訳ありません。,叱られるのは当然です、申し訳ないです。,叱る,
先生から、きついお目玉をいただいてしまいました。,先生から、きついお目玉を食らってしまいました。,先生から、きついお目玉をもらいました。,先生から、きついお目玉をもらった。,叱る,
朝までのご勤務とは、大変でいらっしゃいますね。,朝までのご勤務とは、大変ですね。,朝までの勤務とは、大変ですね。,朝までの勤務とは、大変だね。,仕事,勤務
今日のご出勤は、ずいぶんごゆっくりでございますね。,今日のご出勤は、ずいぶんごゆっくりですね。,今日の出勤は、ずいぶんゆっくりですね。,今日の出勤は、ずいぶんゆっくりだね。,仕事,勤務
日曜日であるにもかかわらず、出勤なさるのですか？,日曜日なのに、出勤なさるんですか？,日曜日なのに、出勤するのですか？,日曜日なのに、出勤するの？,仕事,勤務
社長は本日、ご出社のご予定でしょうか？,社長は本日、ご出社のご予定でしょうか？,社長は今日、出社の予定でしょうか？,社長は今日、出社の予定か？,仕事,勤務
課長は出社なさっていらっしゃいますか？,課長は出社なさっていらっしゃいますか？,課長は出社していますか？,課長は出社しているか？,仕事,勤務
ヨーロッパへのご出張は、長くなりそうですか？,ヨーロッパへのご出張は、長くなりそうですか？,ヨーロッパへの出張は、長くなりそうですか？,ヨーロッパへの出張は、長くなりそうか？,仕事,勤務
沖縄に出張なさるなら、お土産に星の砂をお願いしますね。,沖縄に出張なさるなら、お土産に星の砂をお願いね。,沖縄に出張するなら、お土産に星の砂をお願いね。,沖縄に出張するなら、お土産に星の砂をお願いね。,仕事,勤務
ずっとご精勤でしたのに、今日はどうなさったのかしら。,ずっとご精勤でしたのに、今日はどうなさったのかしら。,ずっと精勤だったのに、今日はどうしたんでしょう。,ずっと精勤だったのに、今日はどうしたんでしょう。,仕事,勤務
お疲れでしょうか、毎日精勤なさっていましたから。,お疲れかしら、毎日精勤なさっていらしたから。,お疲れでしょうか、毎日精勤していたから。,お疲れかな、毎日精勤してたから。,仕事,勤務
専務は本日は八時に退社の予定でございます。,専務は本日は八時にご退社の予定です。,専務は今日は八時に退社の予定です。,専務は今日は八時に退社の予定だ。,仕事,勤務
専務はもう退社なさいましたか？,専務はもう退社なさいましたか？,専務はもう退社しましたか？,専務はもう退社したのか？,仕事,勤務
このマンションは、ご通勤にも便利な物件でございます。,このマンションは、ご通勤にも便利な物件です。,このマンションは、ご通勤にも便利な物件です。,このマンションは、ご通勤にも便利な物件だ。,仕事,勤務
