レベル1,レベル2,レベル3,レベル4,フィールド,フィールド詳細
かなり以前から、ご不調を訴えておられました。,かなり以前から、ご不調を訴えておられましたからね。,かなり以前から、不調を訴えてました。,かなり以前から、不調を訴えてたよ。,体調,気づく
足をどうかなされたのですか？歩き方がちょっと・・・,足をどうかなさったんですか？歩き方がちょっと・・・,足をどうしたんですか？歩き方がちょっと・・・,足をどうしたの？歩き方がちょっと・・・,体調,気づく
少々、お遊びが過ぎるのではありませんか？,少々、お遊びが過ぎるんじゃありませんか？,少し、遊びが過ぎるのではないですか？,少し、遊びが過ぎるんじゃない？,態度,からかう
そんなにお苛めにならないでくださいませ、まだ新米なのですから。,そんなにお苛めにならないでください、まだ新米なんですから。,そんなに苛めないでください、まだ新米なんですから。,そんなに苛めないで、まだ新米なんだから。,態度,からかう
バカなことをなさるのも、いい加減になさってください。,バカをお演じになるのも、いい加減になさい。,バカなことをするのも、いい加減にしてください。,バカなことをするのも、いい加減にして。,態度,からかう
私をお担ぎになるなら、もう少しマシな嘘をおつきになってください。,私をお担ぎになるなら、もう少しマシな嘘をおつきなさいな。,私を担ぐなら、もう少しマシな嘘をつきなさい。,私を担ぐなら、もう少しマシな嘘をつきなよ。,態度,からかう
ひどいですわ、おからかいにならないでください。,ひどいわ、おからかいにならないでください。,ひどいわ、からかわないでください。,ひどいわ、からかわないでよ。,態度,からかう
そんなにお絡みになられたら、可哀そうに存じます。,そんなにお絡みになったら、可哀そうよ。,そんなに絡んだら、可哀そうですよ。,そんなに絡んだら、可哀そう。,態度,からかう
本気でいらっしゃいますか？お戯れにならないでください。,本気ですか？お戯れにならないでください。,本気ですか？戯れないでください。,本気？戯れないで。,態度,からかう
お惚けになるのも、いいかげんになさってください。,お惚けになるのも、いいかげんにしてください。,惚けるのも、いいかげんにしてください。,惚けるのも、いいかげんにして。,態度,からかう
あなたはお乗せになるのがお上手でいらっしゃるから、まいってしまいます。,あなたはお乗せになるのが上手いんだから、まいっちゃう。,あなたは乗せるのが上手いから、まいってしまいます。,あなたは乗せるのが上手いから、まいるわ。,態度,からかう
お酒の席だとしても、おふざけにならないでくださいますか。,お酒の席だからって、おふざけにならないでください。,お酒の席だからって、ふざけないでください。,お酒の席だからって、ふざけないで。,態度,からかう
昨夜はかなりお乱れになられたようですが。何かございましたか？,昨夜はかなりお乱れになったようね。何かあったの？,昨夜はかなり乱れたようね。何かあったのですか？,昨夜はかなり乱れたようね。何かあったの？,態度,からかう
あなたのそんなご挑発になぞ、乗るつもりはございません。,あなたのそんなご挑発になんか、乗るもんですか。,あなたのそんな挑発になんか、乗るもんですか。,あなたのそんな挑発になんか、乗るもんか。,態度,からかう
あなたはいつもそのようなおっしゃり方で挑発なさるのですね。,あなたはいつもそんな言い方で挑発なさるのね。,あなたはいつもそんな言い方で挑発するのね。,あなたはいつもそんな言い方で挑発するね。,態度,からかう
二代目は、ご不摂生がたたって、身体をお壊しになられました。,二代目は、ご不摂生がたたって、身体を壊してしまいました。,二代目は、健康に気にしていないなので、身体を壊してしまいました。,二代目は、健康に気をつけなかったので、身体を壊したのよ。,態度,からかう
羽目をお外しになるのも、程ほどになさってください。,羽目を外されるのも、程ほどになさってください。,羽目を外すのも、程ほどにしてください。,羽目を外すのも、程ほどにしてね。,態度,からかう
あなたは、嘘をおつきになるのが、ほんとに下手でいらっしゃいますね,あなたって、嘘をおつきになるのが、ほんとに下手ねぇ。,あなたって、嘘をつくのが、ほんとに下手ですね。,あなたって、嘘をつくのが、ほんとに下手ねぇ。,態度,口振り
そんな噂をお流しになったのは、どなたでいらっしゃいますか？,そんな噂をお流しになったのは、どなたかしら？,そんな噂を流したのは、誰かしら？,そんな噂を流したのは、誰？,態度,口振り
そろそろ年貢をお納めになったらいかがでしょうか？お噂になっていらっしゃいますよ。,そろそろ年貢をお納めになったら？お噂よ。,そろそろ年貢を納めたら？噂ですよ。,そろそろ年貢を納めたら？噂よ。,態度,口振り
どなたのお噂してらしたのですか？あなたのお噂するなんてとんでもございません。,誰のお噂してらしたの？あなたのお噂するなんてとんでもない。,誰の噂してたのですか？あんたの噂するなんてとんでもないです。,誰の噂してたの？あんたの噂するなんてとんでもないよ。,態度,口振り
あの方は、ほんとにお口が軽くていらっしゃるから。,あの人は、ほんとにお口が軽いんですから。,あの人は、ほんとに口が軽いんですから。,あの人は、ほんとに口が軽いんだから。,態度,口振り
本当にあなたはお口が悪い人でいらっしゃいますね。,本当にあなたはお口が悪い人ですね。,本当にあなたは口が悪い人ですね。,本当にあなたって口が悪い人だよね。,態度,口振り
あのお口振りでは、例の件は無理でございますね。,あのお口振りでは、例の件は無理ですね。,あの口振りでは、例の件は無理ですね。,あの口振りだと、例の件は無理だね。,態度,口振り
お芝居がお上手でいらっしゃいますね。下手なお芝居はおやめになったらいかがですか？,お芝居がお上手ね。下手なお芝居はおやめになったら？,芝居が上手ですね。下手な芝居はやめたら？,芝居が上手ね。下手な芝居はやめなよ？,態度,口振り
またそんなお上手ばっかりおっしゃって。話をすりかえるのがお上手でいらっしゃいますね。。,またそんなお上手ばっかり。話をすりかえるのがお上手ね。,またそんな上手ばっかり。話をすりかえるのが上手ですね。,またそんな上手ばっかり。話をすりかえるのがうまいね。,態度,口振り
また私をお騙しになるのですね？,また私をお騙しになるのね？,また私を騙すのね？,また私を騙すの？,態度,口振り
まあ、ご冗談ばっかりおっしゃって。ご冗談を。お褒め頂いても何も出ませんよ。,まあ、ご冗談ばっかり。ご冗談を。褒めても何も出ませんよ。,まあ、冗談ばっかり。冗談を。褒めても何も出ませんよ。,まあ、冗談ばっかり。冗談を。褒めても何も出ないよ。,態度,口振り
まあ、ご辛辣でいらっしゃいますね。なかなか、ご辛辣でいらっしゃいますね。,まあ、ご辛辣ねえ。なかなか、ご辛辣ですねえ。,まあ、辛辣ねえ。なかなか、辛辣ですねえ。,まあ、辛辣だね。けっこう、辛辣だよね。,態度,口振り
いつもあなたは、言葉をお濁しになってばかりいらっしゃるんですから。,いつもあなたは、言葉をお濁しになってばかりなんですから。,いつもあなたは、言葉を濁してばかりなんですから。,いっつもあなたは、言葉を濁してばっかりなんだから。,態度,口振り
けっしてお怒りのご口調ではございませんでした。,けっしてお怒りのご口調ではありませんでしたよ。,全然、怒りの口調ではなかったですよ。,全然、怒りの口調ではなかったよ。,態度,口振り
クラス会ではお国言葉が飛び交って、賑やかでございましたね。,クラス会ではお国言葉が飛び交って、賑やかでしたね。,クラス会ではお国言葉が飛び交って、賑やかでしたね。,クラス会ではお国言葉が飛び交って、賑やかだったよ。,態度,口振り
差し支えなければ、私が相手をさせていただきます。,よろしければ、私がお相手をいたしましょう,よかったら、私がお相手しましょうか,相手しようか？,席,中座
こちらの席が空いております。差し支えなければこちらにお移りになるのはいかがでしょうか,席が空いていますから、こちらに移られたらいかが？,この席空いてますよ。こちらにどうですか？,ここくれば？開いてるよ,席,中座
いかがでしょう。こちらにお移りになりませんか？,こちらにお移りになりませんか？,こちらの席に来ませんか？,ここに来る？,席,中座
窓際の明るい席をご用意しましょうか,机を明るい窓際にお移ししましょうか？,明るい窓際に机を移しましょうか？,机、こっちの明るい窓際にしようか？,席,中座
おくつろぎでいらっしゃるところ、大変失礼します。,おくつろぎのところ、失礼いたします。,くつろいでいるところすみません。,ゆっくりしてるところごめんね？,席,中座
私のような者が入ってよろしいですか？,私みたいな者がおじゃまして、いいんですか？,私のような者が入ってよいですか？,私が入ってもいいの？,席,中座
私では場違いでしょうが、そこは雰囲気づくりということでご勘弁ください。,私、おじゃま虫かしら？でも可愛いからいいでしょ？,お邪魔ですか？まあ、あだ花ってことでご容赦ください,ごめん、邪魔だよね。かわいいからゆるしてくれるよね？,席,中座
ご歓談中のところ、失礼いたします。,お話し中、失礼いたします。,お話し中に、失礼します。,お話し中にごめんね。,席,中座
お待たせして申し訳ございません。/お待たせしました。,お待たせしてすみません。/お待たせしました。,お待たせしてすみません。/お待たせしました。,待たせてごめんね。/お待たせ。,席,中座
申し訳ありません。少しお待ちいただいてよろしいでしょうか。,ごめんなさい、ちょっとお待ちになってね,ごめんなさい。もう少しお待ちください。,ごめんね。ちょっと待っててね。,席,中座
失礼ですが、ご相席してもよろしいでしょうか？,こちら、ご相席よろしいでしょうか。/ご相席、構いません？,こちらご相席してもいいですか？,相席してもいい？,席,中座
こちらの席でご一緒させていただいてもよろしいですか？,こちらにご一緒してよろしいかしら？,この席でご一緒していいですか？,ここ、混ざっていい？,席,中座
申し訳ありませんが、少々席を外させていただきます。,ちょっと失礼いたします。,すみません、少し席を外します。,ちょっと外すけどいい？,席,中座
失礼ですが、ソースを取っていただけないでしょうか,すみませんが、おソースを取っていただけませんか？,すみません、ソースを回してもらえませんか？,そこのソース取ってもらっていい？,席,中座
失礼します。少しそちら側に席を詰めていただくことはできますでしょうか？,ちょっとごめんください。もう少し席を詰めていただけませんか？,すみません。席を詰めていただけませんか？,ごめん、ちょっと席詰めてもらっていい？,席,中座
失礼ですが、仲人さんとのお打ち合わせはどのくらいされましたか？,仲人さんとは、十分打ち合わせなさったのですか？,仲人さんとは十分打ち合わせされました？,仲人さんとちゃんと詳しく打ち合わせしたの？,相談,
明日の件はどのようなお話になってますか？,明日の件は、お打ち合わせになりましたか？,明日の件ですが、打ち合わせされてますか？,明日の事、打ち合わせた？,相談,
打ち合わせをするのに時間をいただけないでしょうか,お打ち合わせする時間を、取っていただけませんか？,打ち合わせするのに少し時間をもらえませんか？,打ち合わせの時間を取ってもらっていい？,相談,
そちら様が詳しくご存じだと思います。少しご教授いただけないでしょうか。,博識のあなたにぜひ、お知恵をお借りしたいのですが。,いろいろご存じと思いますので、知恵を貸していただけないでしょうか。,ちょっと教えてもらいたいことがあるんだけど、そちはいろいろ知ってるから。,相談,
ご存じでしたらぜひ教えていただけないでしょうか。,ぜひ、あなたのお知恵を拝借したいのですが。,知っていたら教えていただけないでしょうか。,知ってたら教えて欲しいんだけど,相談,
このプロジェクトに関しては、本社にご確認いただく方がよろしいかと存じます。,このプロジェクトは、本社にお諮りになった方がよろしいのでは？,このプロジェクトは、本社に打診してみたらどうでしょう,このプロジェクト、本社に聞いてみたほうがいいよ。,相談,
相続に関しましては、ご家族で十分お話になることをお勧めします。,相続のことは、ご家族でじっくりお話し合いをなさってください。,相続のことは家族でじっくり話した方がいいですよ,相続はねえ、家族でまずじっくり話してからだよね。,相談,
リーダー同士で夜更けまでお話し合いをされてました,リーダー同士、夜更けまでお話し合いになっておられました,リーダー同士で夜更けまで話し合いしてましたよ,リーダー同士で夜更けまで話し合いしてたよ。,相談,
その件につきましては、十分な協議をされますように,その件については、十分にご協議ください。,その件については十分にお話し合いしてください,その件は、十分に話し合ってね。,相談,
十分に協議されて決めたことでしたら、それでいいと思います。,十分に協議なさった結果なら仕方ないですね。,十分に協議したんですね。その結果でしたらそうしましょう。,十分話し合ったんだよね。じゃあいいよ、それで。,相談,
部長は、この商談に気が進まないと言っていました。,部長は、この商談にあまり乗り気ではないようです。,部長はこの商談に乗り気ではないようです。,部長はこの商談に乗り気じゃないようだよ,相談,
本日は、かねてより相談したいことがあり、参上しました。,今日は、折り入ってご相談したいことがあって伺ったのですが。,今日は相談したいことがあったため、来ました。,今日はずっと相談したいことがあって来た。,相談,
進路についての相談でしたら、あの先生が適任と存じます。,進路について相談なさるなら、あの先生がいいですよ。,進路についての相談でしたら、あの先生が良いと思います。,進路についての相談ならあの先生が良いと思うよ。,相談,
何か改善策はありますでしょうか？,何かご助言をいただけませんか？,何かアドバイスはありますか？,何かアドバイスはある？,相談,
今後に関しましては、お二方で話し合ったほうが良いと存じます,今後のことは、お二人でよく話し合われたほうがいいですね。,今後については二人で話し合ったほうが良いと思います。,今後については二人でしっかり話し合ってね,相談,
こちら、いただいたものです。いかがでしょうか。,いただき物ですが、おひとつどうぞ。,これ、頂き物なんですが、ひとつどうぞ。,これ、いただいたの。ひとつどうぞ。,贈答,あげる
お口に合うかわかりませんが、おひとついかがですか？,お口汚しですが、おひとつどうぞ。,口に合うかどうかわからないですが、ひとつどうですか？,たいしたものじゃないけど、食べる？,贈答,あげる
せっかくのご縁ですし、どうぞお納めください。,お近づきのお印に。/ほんのお印ですが...。,これも何かの縁ですから、どうぞ。,お近づきのお印にどうぞ。,贈答,あげる
お店の物でなくて恐縮ですが、よろしければみなさまで,手料理でお恥ずかしいんですが...。皆さんでどうぞ。,これ作ってきたのですが、よければみなさまで,作ってきたから、みんなで食べてね。,贈答,あげる
これ、近所で評判の品です。よろしければおひとつどうぞ。,近所で評判の品ですが、おひとつ。,近所で評判なんですよ。ひとついかがですか？,これ近所で人気があるんだよね。ひとつあげる。,贈答,あげる
頂き物のお福分けでございます。ぜひお召し上がりください。,いただき物のお福分けですが、召しあがってください。,おすそ分けです。いかがですか？,頂き物のおすそ分けあげる。,贈答,あげる
気持ちばかりのものですが、ご賞味ください。,気持ちばかりのものですが、どうぞお納めください,気持ちばかりですがおひとついかがですか。,おひとつどうぞ。,贈答,あげる
ご受納いただけましたら幸いでございます。,どうか、ご受納いただけましたら幸いでございます。,お受け取りいただけましたら幸いです。,受け取ってもらえるとうれしいな。,贈答,あげる
記念品でございます。どうぞお確かめください。,記念の品でございます。どうぞご笑納ください。,記念品ですお受け取り下さい。,記念品、どうぞ受け取って。,贈答,あげる
生牡蠣をお送り致します。どうぞお確かめください。,生牡蠣を少々送りました。どうぞご笑納ください。,生牡蠣を送りましたどうぞ食べてください。,牡蠣を送ったよ、食べてね。,贈答,あげる
弊社の創業五十周年記念誌です。お確かめください。,小社の創業五十周記念記念誌、どうぞ笑覧ください。,記念誌です。ぜひご覧ください,記念誌だよ。ぜひみてね。,贈答,あげる
ささやかではございますが、お礼の品をお受け取り下さい。,ささやかなものですが、お礼の印です。,ささやかですがお礼の品を受け取ってください。,お礼です。受け取ってね,贈答,あげる
ご来館の記念に粗品をどうぞ。,粗品でございますが、ご来館の記念にどうぞ。,来館の記念に粗品をどうぞ。,記念に粗品をどうぞ。,贈答,あげる
気持ちばかりのものですが、お納めください。,ほんの気持ちです。どうぞお納めください。,気持ちばかりですが受け取ってください。,気持ちばかりだけど、ぜひ受け取ってね。,贈答,あげる
高価なものをいただいて、よろしいのですか？,こんなに高価なものをいただいて、よろしいんですか？,高価なものをいただいてよいのですか？,こんなに高価なものをいいの？,贈答,もらう
珍しいものを頂戴いたしまして、ありがとうございます。,珍しいものを頂戴いたしまして、ありがとうございます。,珍しいものをお送りいただき、ありがとうございます。,良いものを送ってくれてありがとう。,贈答,もらう
私にはもったいないと存じますが、ありがたくお受けします。,私などにはもったいないですが、ありがたくお受けします。,私にはもったいないかと思いますが、ありがたくいただきます。,私にはもったいないと思うけど、ありがたくいただくね。,贈答,もらう
車椅子をご恵贈いただきまして、ありがとうございます。,車椅子をご恵贈いただきまして、ありがとうございます。,車椅子を送りいただき、ありがとうございます。,車椅子を送ってくれてありがとう。,贈答,もらう
それでは、来賓の先生にお言葉を賜りたいと存じます。,それでは、来賓の先生にお言葉を賜りたいと存じます。,それでは、来賓の先生にお言葉を賜りたいと思います。,では、来賓の先生に何か言ってもらおう。,贈答,もらう
それではお言葉に甘えてありがたく頂戴いたします。,それでは、ありがたく頂戴いたします。,ではお言葉に甘えて、ありがたくいただきます。,じゃあお言葉に甘えていただくね。,贈答,もらう
それでは、恐縮ですがお気持ちだけいただきます。,それでは、お気持ちだけ頂戴します。,それでは、お気持ちだけいただきます。,それじゃあ、お気持ちだけいただいておくね。,贈答,もらう
お心のこもった贈り物いただき、身に余る光栄です。,お心のこもった贈り物を頂戴し、身に余る光栄です。,贈り物をいただき、とてもうれしいです。,贈り物もらって、とてもうれしいありがとう。,贈答,もらう
お言葉に甘えて、遠慮なく頂戴します。,お言葉に甘えて、遠慮なく頂戴します。,お言葉に甘えて、いただきます。,では遠慮なくいただくね。,贈答,もらう
過分なお祝いをいただきまして、ありがとうございます。,過分なお祝いをいただきまして、ありがとうございます。,お祝いをいただき、ありがとうございます。,お祝いをありがとう。,贈答,もらう
私はいくついただけるのでしょうか？,私には、いくつくださるの？,私はいくつもらえつのでしょう？,私はいくつもらえるの？,贈答,もらう
先日は実に余るものをいただきまして、恐縮であります。,先日は結構なものを頂戴いたしまして、恐縮です。,先日はどうもありがとうございました,先日はどうもありがとう。,贈答,もらう
おこぼれに預かるなんて、低俗な考えだったかもしれません。,おこぼれに預かるなんて、さもしい考えでしたね。,おこぼれに預かるのは醜いですね。,おこぼれに預かるとは醜いな。,贈答,もらう
おまけに惹かれて、ついつい購入してしまいました。,おまけに引かれて、ついつい買ってしまうんですよね。,おまけに惹かれて、購入してしまいました。,おまけに惹かれて、ついつい買っちゃった。,贈答,もらう
もし作品がお余りになりましたら、何かひとつ、譲っていただけないでしょうか？,作品がお余りになったら、何かひとつ、譲っていただけませんか？,もし作品が余ったら、ひとつ譲っていただけないでしょうか？,作品が余ったらひとつちょうだい？,贈答,もらう
奥様の誕生日にダイヤモンドをおあげになったそうですね。,奥様の誕生日にダイヤモンドをおあげになったそうですね。,奥様の誕生日にダイヤモンドをあげたそうですね。,奥さんの誕生日にダイヤモンドを送ったみたいだね。,贈答,
あの娘に歌舞伎のチケットお渡しになられたのですか？,あの娘に歌舞伎のチケットおやりになったんですか？,娘さんに歌舞伎のチケットをあげたのですか？,あの娘に歌舞伎のチケットあげたの？,贈答,
