レベル1,レベル2,レベル3,レベル4,フィールド,フィールド詳細
この品物は、素材が貴重なものを使っておりますため、その分お値段が少々お高めとなっております。,こちらは素材が貴重な分、少々お高めになっております。,こちらは、素材が貴重な分、少々値段が高くなっています。,これ、材料が貴重だから、ちょっと高いの。,買う,値段
お値段は決してお安いとは申し上げられませんが、品質はしっかりとした品物です。,けっしてお安くはありませんが、しっかりとした品物です。,値段は安くはないですが、しっかりとした品物です。,けっこう高いけれど、いい品だよ。,買う,値段
こちらの花瓶は、お値打ちものとなっております。,この花瓶は、お値打ちものですよ。,この花瓶は、お買い得です。,この花瓶、買いですよ。,買う,値段
良いお品物は、長持ちいたしますから、結局お得となります。,いい物は長持ちしますから、結局、お得です。,いい物は、長持ちするので、結局お得です。,いい物は長持ちするから、結局、得だよ。,買う,値段
こちらは、本日のお値打ち品となっております。,こちらは本日のお買得商品でございます。,こちらは、本日のお買い得商品です。,これ、今日のお買い得。,買う,値段
こちらの商品は、お求めになりやすい価格といたしております。,こちらはお手頃価格になっております。,こちらはお手頃価格になっています。,これ、お手頃価格だよ。,買う,値段
こちらの洗剤が、お徳用となっております。,こちらの洗剤が、お徳用になっております。,この洗剤がお徳用です。,この洗剤、徳用。,買う,値段
こちらはご奉仕価格とさせていただいております。,こちらはご奉仕価格になっております。,こちらは、お買い得です。,これ、お買い得。,買う,値段
本日お買い上げいただいた方には、ポイントを三倍お付けいたしております。,本日お買い上げの方には、ポイントを三倍お付けします。,本日お買い上げの方には、ポイントを三倍お付けします。,今日買うと、ポイント三倍です。,買う,値段
ただいま、サービス期間となっておりますので、一割お引きいたしております。,サービス期間中ですので、一割お引きいたします。,サービス期間中ですので、一割引きです。,サービス期間中だから、一割引きだよ。,買う,値段
付録品があると伺うと、つい買い求めてしまいます。,おまけがつくと聞くと、つい買ってしまうのよね。,おまけがつくと聞くと、つい買ってしまいます。,おまけがもらえるって聞いたら、つい買っちゃう。,買う,値段
奥様、本日は、特別な価格とさせていただきます。,奥さん、今日は特別に、おまけしましょう。,奥さん、今日は特別におまけしましょう。,奥さん、今日は安くしとくよ。,買う,値段
お勤めになられているのですか？学生さんかと存じ上げておりました。,お勤めしてらっしゃるの？学生さんかと思いました。,お勤めなんですか？学生さんかと思いました？,働いているの？学生かとおもった。,学校,
あちらの方は、生徒さんたちに人気のある先生でいらっしゃいます。,あの方は、生徒さんたちに人気のある先生なんですよ。,あの方は、生徒さんたちに人気のある先生なんですよ。,あの先生、生徒に人気あるんだよ。,学校,
お子様方がご自宅にお帰りの際の見守りを、ご父兄の方々にお願い申し上げております。,下校時の見守りを、ご父兄の皆様にお願いいたします。,下校時の見守りを、父兄の皆さんにお願いします。,下校の時には、家の人が見守ってください。,学校,
貴校の国公立大学進学率は、お見事と感嘆いたしました。,貴校の国公立大学進学率はすごいですね。,貴校の国公立大学進学率はすごいですね。,そっちの学校、国公立大学進学率、すごいね。,学校,
当校は、小中一貫教育を実施いたしております。,当校は、小中一貫教育を実施しております。,当校は、小中一貫教育を実施しております。,うちの学校。小中一貫教育なんだ。,学校,
物理を受け持たれていらっしゃるのですか？,物理を受け持たれていらっしゃるんですか？,物理を担当しているのですか？,物理の担当？,学校,
ご父兄の方々に、学芸会のご参観をお願い申し上げております。,ご父兄の皆さまに、学芸会のご参観をお願いいたします。,父兄の皆さん、学芸会を参観してください。,おうちの人たち、学芸会を見にきて。,学校,
ご参観なさる方は、こちらで上履きにお替えいただくようお願い申し上げております。,参観なさる方は、ここで上履きに履き替えてください。,参観する人は、ここで上履きに替えてください。,参観する人は、ここで上履きに替えて。,学校,
先生のご出題のテーマは「環境」でいらっしゃいます。,先生のご出題のテーマは「環境」です。,先生の出題テーマは「環境」です。,先生の出題テーマ、「環境」だって。,学校,
入社試験の問題を近代史からご出題なさったのですか？,入社試験の問題を近代史から出題なさったんですか？,入社試験の問題を近代史から出題したんですか？,入社試験の問題、近代史から出したの？,学校,
あの先生が授業なさるのは、本日が最後となります。,あの先生が授業なさるのは、今日が最後です。,あの先生が授業するのは今日が最後です。,あの先生の授業、今日で最後。,学校,
帰国子女クラスをご担任でいらっしゃいますか。大変興味深く存じます。,帰国子女クラスをご担任ですか、面白そうですね。,帰国子女クラスの担任ですか、面白そうですね。,帰国子女クラスの担任？面白そうだね。,学校,
小学校一年生をご担任なさるのは、ご苦労が多々おありかと存じます。,小学校一年生を担任なさるのは大変ですね。,小学校一年生の担任って大変そうですね。,小学校一年生の担任って大変そうだね。,学校,
創立記念日にご来校いただきまして、まことに感激いたしております。,創立記念日にご来校いただきまして、感激です。,創立記念日に来ていただいて、感激です。,創立記念日に来てくれて、感激！,学校,
ノーベル賞受賞の先生がご来校なさるのは、この度が二度目でございます。,ノーベル賞受賞の先生が来校なさるのは、今回で二度目です。,ノーベル賞受賞の先生が来るのは、今回で二度目です。,ノーベル賞受賞の先生が来るの、これで２回目です。,学校,
もしご失敗とお思いでも、どうぞ、そのようにお気を落とされませんように。,失敗したからって、そんなに意気消沈なさらなくても・・・。,失敗だとしても、そんなにがっかりなさらないで。,失敗したからって、そんな、がっかりするなって。,がっかり,
ご謙遜でいらっしゃるようですが、どうぞ正々堂々となさられますように。,そんなに萎縮なさることはないわよ、胸を張って！,萎縮なさることはございません。堂々となさってください。,何を、ちぢこまっちゃって！胸を張って！,がっかり,
お母様は、御子息の不祥事に消沈なさっていらっしゃいました。,お母様は、息子さんの不祥事にうなだれていらっしゃいました。,お母様は、息子さんの不祥事にうなだれていました。,お母さんは、息子さんの不祥事にしょんぼりしてた。,がっかり,
落胆が大きくいらっしゃいますね。どうぞお元気を取り戻されますように。,ずいぶん落ち込まれていますね、元気を出してください。,ずいぶん落ち込まれていますね。元気をだしてください。,ずいぶんがっかりしているね。元気出して！,がっかり,
どうぞ、あまりお塞ぎになられませんように。,そんなに、お塞ぎにならないでくださいね。,そんなに、お塞ぎにならないでくださいね。,そんなしょんぼりしないでね。,がっかり,
大会出場が取りやめられたとのことで、監督は消沈していらっしゃいます。,大会に出場できなくなって、監督はがっくり肩を落とされています。,大会に出場できなくなって、監督はがっくり肩を落とされています。,大会に出られなくなっちゃったから、監督はとてもがっかりしている。,がっかり,
どうぞ、ご消沈なさいませんように。,そんなに、がっかりなさらないでください。,どうぞ、がっかりしないでくださいね。,そんながっかりしないで！,がっかり,
ご機会を失われ、ご落胆のほど、お察し申し上げます。,チャンスを逃して、気を落とされるのは無理もない。,機会を逃して、気を落とされるのは無理もありません。,チャンスを逃して、がっかりするのは、わかるよ。,がっかり,
深いご失望のほどをお察し申し上げます。,ご失望の色が、お顔に出ていますよ。,がっかりなさいましたよね。,がっかりしたんだよね。わかる。,がっかり,
まだお若くいらっしゃいますので、どうぞ失望なさらないでください。,まだお若いんだから、失望なさることはありません。,まだお若いのですから、失望なさらないでください。,若いんだから、がっかりしないの。,がっかり,
いかがなさいましたか。ご消沈の様子を拝察いたします。,どうなさったの？ひどくご消沈のようですが。,どうしましたか？何か困ったことありましたか？,どうしたの？なんかがっかりしてる？,がっかり,
棟梁は、台風が原因で五重塔が壊されてしまい、たいそう落胆しておられます。,棟梁は、台風で五重塔が破壊されて、ご落胆のご様子です。,棟梁は、台風で五重塔が破壊されて、落胆の様子です。,棟梁は、台風で五重塔がこわれちゃって、がっかりしているみたい。,がっかり,
明けない夜はないと申します。どうぞご落胆なさいませんように。,明けない夜はないと言いますよ、そんなに落胆なさらずに。,明けない夜はないと言いますよ。そんなに落胆しないでください。,明けない夜はないんだってよ。そんな、がっかりしないで。,がっかり,
どうぞ、力を落とされませんように。,そんなに力を落とされることはありませんよ。,そんなに力を落とさないでくださいね。,元気出して。,がっかり,
就職試験がご希望通りにならなかったとしても、あまりご悲観なさいませんように。,就職試験に落ちたくらいで悲観なさることはありませんよ。,就職試験がうまくいかなくとも、悲観なさらないでくださいね。,就職試験に落ちたって、がっかりすることないって。,がっかり,
試験の日は大雪が降っていて、大変苦労しました。,お試験の日は、大雪で大変でした。,試験の日は大雪で大変でした。,試験の日は大雪で大変だったよ。,学校,
そちらは、お受験はどうされるご予定ですか。,お宅は、お受験はどうなさるの？,あなたの家は、お受験の予定はありますか？,あなたの子ども、受験はどうする？,学校,
驚きました、お嬢様は十校も受験されたのですね。,驚いた、お嬢さんは十校も受験なさったんですって？,驚いた、お嬢さんは十校も受験したんですね。,びっくりした、お嬢さん、十校も受験したのね。,学校,
志望校に合格なさって良かったです、おめでとうございます。,志望校に合格なさって良かったですね、おめでとう。,志望校に合格して良かったですね、おめでとう。,志望校に合格してよかった、おめでとう。,学校,
春から幼稚園にご入園されるのですか？　おめでとうございます。お早いものですね。,春から幼稚園にご入園ですか？　おめでとう。早いものですね。,春から幼稚園に入園ですか？　おめでとうございます。早いものですね。,春からもう幼稚園に入園か。おめでとう。あっという間だね。,学校,
ご入学の記念撮影は、当店で承ります。,ご入学の記念撮影は、当店で承ります。,ご入学の記念撮影は、当店で行います。,入学の記念撮影は、うちの店でやってあげるよ。,学校,
ご長男は国立大学の医学部にご入学なさるそうですね。,ご長男は国立大学の医学部に入学なさるそうですね。,ご長男は国立大学の医学部に入学するんですね。,長男くんは国立大学の医学部に入学するんだね。,学校,
遠距離のご通学は大変なご苦労だったかと存じます。,遠距離のご通学は大変でしたね。,遠距離の通学は大変でしたね。,遠距離の通学は大変だったね。,学校,
満員のメトロを乗り継いでご通学されたと伺っております。,満員のメトロを乗り継いで通学なさったそうですね。,満員のメトロを乗り継いで通学したそうですね。,満員のメトロを乗り継いで通学したんだってね。,学校,
ご子息はお元気に登校されていますか？,坊ちゃん、元気に登校なさっていますか？,坊ちゃん、元気に登校していますか？,坊ちゃん、元気に登校している？,学校,
お父様とご一緒の学校にご進学されますか？,お父様と同じ学校にご進学ですか？,お父さんと同じ学校に進学しますか？,お父さんと同じ学校に進学するの？,学校,
工学部にご進学なさるんですか、ご将来が楽しみですね。,工学部に進学なさるんですか、将来が楽しみですね。,工学部に進学するんですか。将来が楽しみですね。,工学部に進学するんだ、将来が楽しみだね。,学校,
ご卒業おめでとうございます。ご就職は都庁だと伺っております。,ご卒業おめでとう。就職は都庁だそうですね。,ご卒業おめでとうございます。就職は都庁だそうですね。,卒業おめでとう。就職は都庁だって？,学校,
ようやくのご卒業ですね、胸がいっぱいかと存じます。,やっと卒業なさるのね、感無量でしょう？,やっと卒業するんですね、感無量ですね。,やっと卒業か、感無量だね。,学校,
おじは、麻雀に夢中になってしまい落第してしまったそうです。,おじ様は、麻雀ばかりして落第なさったらしいわよ。,おじさんは、麻雀ばかりして落第してしまったらしいです。,おじさん、麻雀ばっかりやって落第しちゃったって聞いた。,学校,
美味しいお料理、ごちそうさまでした。お会計をお願いいたします。,美味しいお料理でした。お愛想してください。,おいしいお料理、ありがとうございました。お会計をお願いします。,美味しかったよ。会計をよろしく。,金,会計
お会計をお願いいたします。,お会計をお願いします。,お会計をお願いします。,会計してください。,金,会計
お勘定をお願いいたします。,お勘定をお願いします。/お勘定はいかほどでしょうか。,お勘定をよろしくです。,お勘定、頼むよ。,金,会計
こちらはお代を既に頂戴しております。,こちらはお代済みでございます。,こちらはお代をもう受け取っています。,こちらは既に代金をもらっているよ。,金,会計
お代金は先に頂戴いたしました。,お代金は先に頂戴しています。,代金は先にいただきました。,代金は先にいただいているよ。,金,会計
六千円のお返しでございます、ご確認をよろしくお願いいたします。,六千円のお返しです、どうぞお確かめください。,六千円のお返しです。お確かめください。,お釣りは六千円です。確かめてね。,金,会計
どうぞ、お釣りをお返しいたします。,どうぞ、お釣りをお返しいたします。,どうぞ、お釣りです。,これ、お釣りだよ。,金,会計
申し訳ありませんが、細かいのをお持ちでいらっしゃいませんか？,細かいのをお持ちではありませんか？,細かいのを持っていませんか？,細かいの持ってない？,金,会計
取り急ぎ、こちらで立て替えておきました。,とりあえず、お立て替えしておきましたから…。,とりあえず、立て替えておきましたから。,とりあえず、立て替えといたよ。,金,会計
課長が立て替えてくださったのですか？,課長がお立て替えになったんですか？,課長が立て替えたんですか？,課長が立て替えてくれたの？,金,会計
生憎と、その日は持ち合わせがなかったようでございまして。,生憎と、その日はお持ち合わせが無かったらしいの。,生憎と、その日は持ち合わせがなかったようで。,生憎、その日はお金を持っていなかったらしいんだ。,金,会計
それでは、先日の打ち合わせ通りご請求いただければと存じます。,それでは、先日の打ち合わせ通りご請求ください,それでは、先日の打ち合わせの通りに請求してくださいね。,それじゃ、先日の打ち合わせの通りに請求してね。,金,会計
先日の件ですが、ご請求してもよろしいでしょうか。,先日の一件、ご請求してよろしいでしょうか？,先日の件、請求してもいいですか？,先日の件なんだけど、請求してもいい？,金,会計
期限はかなり以前に過ぎています。請求なさる方がよいかと存じます。,期限はとうに過ぎています。請求なさる方がよろしいかと…。,期限はとっくに過ぎています。請求した方がいいと思います。,期限はとっくに過ぎているから、請求した方がいいよね。,金,会計
領収書の宛先は、上様でお願いいたします。,領収書の宛先は、上様と書いてください。,領収書の宛先は、上様としてください。,領収証の宛先は、上様でよろしく。,金,会計
お金では買えないものもあるかと存じます。,お金では買えないものもあるんですよ。,お金では買えないものもあるんですよ。,お金では買えないものもあるんだよ。,金,
お足とはよくご表現されたものです、逃げ足が本当にお早いですね。,お足とはよく言いますが、逃げ足の早いことですね。,お足とはよく言ったもんですね、逃げ足が本当に早い。,お足、とはよく言ったものだね。逃げ足がとても早い。,金,
ぴんと張ったお札を釣銭に出していただけるお店は、気分がよくなります。,手の切れるようなお札を釣銭にいただけるお店は、気分がいいです。,手の切れるようなお札を釣銭にしてる店は、気分がいいですね。,手の切れるようなお札を釣銭にしてる店は、いい気分になるね。,金,
ここのところ心許なくて、少しでも何か収入があれば、と思っております。,このところ金欠で。お小遣いでもいいから欲しいです。,このところ空っ穴でしてね。おぜぜの顔が見たい！,このところ儲けがなくてね。お金がほしいよ。,金,
宝物は大切に扱わなければなりません。,宝物は大事に扱うべきです。,お宝は大事に使わなくちゃいけないよ。,お宝は大事に使わなくちゃだね。,金,
あなた様は、案外、お金持ちだったのですね。……失礼いたしました。,あなたって意外と、お金持ちでしたか。失礼しました。,あなたって案外お金持ちだったのね、あら失礼。,君って意外とお金持ちだったんだね、失礼。,金,
私どもとは違い、こちらは裕福な、身分の異なる方ですから…。,私とは違って、こちらはお大尽ですから…。,私どもと違って、こちらはお大尽ですから…。,私とは違って、こっちはお金持ちだから。,金,
指折りの旧家だけありますので、ご身分はご相当なものかと存じます。,指折りの旧家だけあって、ご身分は相当だそうですよ。,指折りの旧家だけあって、ご身分は相当なものらしい。,指折りの旧家だけあるから、身分は相当らしいよ。,金,
棟梁はお金儲けがお上手でない方なのです。,棟梁はお金儲けが下手な方なんです。,棟梁はお金儲けが全く下手な人なんです。,棟梁は稼ぐことがとても下手な人なんだ。,金,
そんなに一生懸命に稼がれて、どうするおつもりですか。,そんなにしゃかりきにお稼ぎになって、どうなさるの？,そんなにしゃかりきにお金を稼いで、どうするつもり？,そんなにしゃかりきに稼いで、どうするつもりだい？,金,
一生懸命お稼ぎになられているそうですね。,せっせと稼がれているそうですね。,せっせと働いているそうですね。,せっせと稼いでいるそうじゃないか。,金,
代々お築きになったご財産を、一夜でつぶしてしまうおつもりですか。,代々お築きになった財産を、一夜でつぶす気ですか？,代々築いた財産を、一夜で潰す気ですか？,代々築いた財産を、君が、一夜でなくしてしまう気なのか？,金,
そのような大金を、どうやって後面なさるおつもりですか。,そんな大金を、どうやって後面なさるおつもりですか？,そんな大金を、どうやって用意するつもりですか？,そんな大金、どうやって用意するつもりなんだ？,金,
僧正は山門の建設資金を、とうとうご調達されました。,僧正は山門の建設資金を、とうとうご調達になりました。,僧正は山門の建設資金を、とうとう調達しました。,僧正は山門の建設資金をとうとう調達したよ。,金,
一体どのように資金をご調達されたのですか。,どこから資金を調達なさったんですか？,どこから資金を集めたんですか？,どこから資金をかき集めたんだ？,金,
それは、僭越ながら、論戦を挑まれた方がよいかと存じます。,そりゃあなた、論戦を挑まれるべきでしょう。,それはあなた、論戦を挑まれた方がよいでしょう。,そりゃ君、論戦を挑まれるべきだろう。,勝つ,競争
それほどまでに続けて勝利されてしまうと、後々が怖いかもしれません。,そんなに続けてお勝ちになると、あとが怖いですよ。,そんなに続けて勝ってしまうと、あとが怖いですよ。,そんなに続けて勝っちゃうと、あとが怖いよ。,勝つ,競争
チャンピオンを倒されたと伺っております。,チャンピオンをお倒しになったそうですね？,チャンピオンを倒したそうですね？,チャンピオンを倒したんだって？,勝つ,競争
あなた様はお相手の弱点を見抜くのがお上手ですね。,あなたは相手の弱点をお突きになるのが、上手いですね。,あなたは相手の弱点を突くのが上手いですね。,君は相手の弱点を突くのが上手い。,勝つ,競争
自らの考えていることをお相手に読まれてしまったら、負けてしまいます。,お手の内を相手に読まれたら、敗けですよ。,手の内を相手に読まれたら、負けです。,手の内を相手に読まれたら負けだ。,勝つ,競争
駒落ちとはいえ、名人に勝利してしまうなんて、すばらしいです！,駒落ちとはいえ、名人をお負かしになるとは、すごい！,駒落ちとはいえ、名人を負かせるなんてすごいです！,駒落ちではあるが、名人から勝つなんてすごいね！,勝つ,競争
