レベル1,レベル2,レベル3,レベル4,フィールド,フィールド詳細
御病気なさったそうですね。回復されたのでしょうか？,病気なさったそうですね。もうすっかりよろしいんですか？,病気なさったそうですね。もう大丈夫ですか？,体調崩してたんだってね。もう平気？,挨拶,久しぶり
本日は温かい気候ですね。,今日はポカポカとして、 いい按配ですね。,今日は温かくて過ごしやすいですね。,今日は温かくて過ごしやすいね。,挨拶,近所で
行ってらっしゃいませ。お気を付けて。,行ってらっしやい、お気をつけて。,行ってらっしゃい。お気を付けて。,行ってらっしゃい。気を付けてね。,挨拶,近所で
皆様、御揃いでお出かけになられるのですか？,皆さん、お揃いでお出かけですか？,皆さん、お揃いでお出かけですか？,みんな揃って出かけるの？,挨拶,近所で
本日はお早いのですね、お散歩ですか？,今日はお早いですね、お散歩ですか？,今日は早いですね、お散歩ですか？,今日は早いね、散歩に行くの？,挨拶,近所で
お早うございます。本日も良いお天気ですね。,お早うございます。今日もいいお天気ですね。,おはようございます。今日も良い天気ですね。,おはよう、今日もいい天気だね。,挨拶,近所で
お早うございます。早朝から御精が出ますね。,お早うございます。朝早くから、ご精が出ますね。,お早うございます。朝早くから精が出ますね。,おはよう、朝早くから頑張ってるね。,挨拶,近所で
こんにちは、お暑うございます。本日は蒸しますね。,こんにちは、お暑うございます。今日は蒸しますね。,こんにちは、暑いですね。今日は蒸してますね。,こんにちは、暑いね。今日は蒸してるね。,挨拶,近所で
こんばんは、お寒うございます。随分ひえますね。,こんばんは、お寒うございます。ずいぶん冷えますね。,こんばんは、寒いですね。随分冷えますね。,こんばんは、寒いね。結構冷えるね。,挨拶,近所で
生憎の御天気ですね。はっきりとしない生憎の御天気ですね。,生憎のお天気ですね。 はっきりしない生憎のお天気ですね。,生憎の天気ですね。はっきりしない生憎の天気ですね。,天気よくないね。はっきりしない天気だね。,挨拶,近所で
こんにちは、お暑うございます。本日は蒸しますね。,こんにちは、お暑うございます。今日は蒸しますね。,こんにちは、暑いですね。今日は蒸しますね。,こんにちは、暑いね。今日は蒸すね。,挨拶,近所で
お寒うございます。本日はやけに冷えますね。,お寒うございます。今日はやけに冷えますね。,寒いですね。今日はやけに冷えますね。,寒いね、今日はやけに冷えるね。,挨拶,近所で
お久しぶりに、良いお湿りでございますね。,久しぶりに、 いいお湿りですね,お久しぶりに、良い湿りですね。,久しぶりに、湿ってるね。,挨拶,近所で
良いお天気ですね。ようやくお布団が干せますね。,いいお天気ですね。やっとおふとんが干せますね。,良いお天気ですね。やっと布団が干せますね。,良い天気だね。やっと布団が干せる。,挨拶,近所で
随分、日が長くなりましたね。,ずいぶん、日が長くなりましたね。,随分、日が長くなりましたね。,結構、日が長くなったね。,挨拶,近所で
日が短くなりましたね、まだ五時前なのに、薄暗いですね。,日が短くなりましたね、まだ五時前なのに、うす暗くて。,日が短くなりましたね、まだ五時前なのに、薄暗いですね。,日が短くなったね、まだ五時前なのに、薄暗いね。,挨拶,近所で
それは良いお考えでございますね。,それはいいお考えですね。,それは良いお考えですね。,ナイスアイディアだね。,あいづち,同意
全くもって、御説の通りでございます。,全く、お説の通りだと思います。,全く、御説の通りだと思います。,その通りだと思うよ。,あいづち,同意
さようでございます。仰る通りです。,そうですとも、おつしやる通りです。,そうですね、その通りです。,そうだね、その通り。,あいづち,同意
課長の御想像通りでございました。,課長のご想像通りでした。,課長のご想像通りでした。,課長の思った通り。,あいづち,同意
それは正しい御判断だと存じます。,それは正しいご判断だと思います。,それは正しい判断だと思います。,それは正しい判断だよ。,あいづち,同意
御説仰る通りでございます。,お説ごもっとも。,御説ごもっとも。,その通り。,あいづち,同意
恐れ入ります、全く仰る通りでございます。,恐れ入ります、全くその通りでございます。,すみません、全くその通りです。,そうそうその通り。,あいづち,同意
仰る通りです、私も同様に存じます。,同感です、私もそう思います。,同感です、私もそう思います。,そうだね、そう思う。,あいづち,同意
参考になります、その様なお考えもございますね。,なるほど、そういう見方もございますね。,なるほど、その様な見方もありますね。,なるほど、そんな見方もあるね。,あいづち,同意
そちらで結構でございます。,それで結構でございます。,それで良いと思います。,それでいーね。,あいづち,同意
御異議がないようでしたら、採決を取らせて頂きたいと存じます。,ご異議がないようでしたら、採決に入りたいと思います。,異議がないようでしたら、採決に入りたいと思います。,異議がなかったら、採決とるね。,あいづち,同意
何卒、三分の二の御賛成を頂きたいと存じます。,何とぞ、三分の二のご賛成をいただきたいのです。,何卒、三分の二の御賛成を頂きたいです。,三分の二の賛成が欲しい。,あいづち,同意
その御考えに賛同いたします。,そのお考えに賛成いたします。,その御考えに賛成します。,賛成だよ。,あいづち,同意
御賛同を頂きました、誠にありがとうございます。,ご賛同をいただきまして、ありがとございます。,御賛同を頂きました、ありがとうございます。,賛成してくれてありがとう。,あいづち,同意
御同意頂きまして、誠にありがとうございます。,ご同意いただきまして、ありがとうございます。,御同意頂いて、ありがとうございます。,同意してくれてありがとう。,あいづち,同意
貴殿がこちらの作品で特に意図なさったのは、どの様なところでしょうか？,あなたがこの作品で特に意図なさったのは、どんなところですか？,あたながこの作品で特に意図したのは、どの様なところですか？,あなたがこの作品で特に考えたのはどんなところ？,アイデア,工夫
奥様は優秀な方でいらっしゃいますが、御決断力が乏しいと存じます。,奥様はお知恵はあるのですが、決断力がないのです。,奥様は優秀な方ですが、決断力が乏しいです。,奥さんは賢いけど、自分で決める事ができないね。,アイデア,工夫
バラの花束に詩を添えて素晴らしい御考えですね。,バラの花束に詩を添えて よく思いつかれたものですね。,バラの花束に詩を添えてよく思いつきましたね。,バラの花束に詩を添えてよく思いついたね。,アイデア,工夫
グループ分けには、さぞ御苦心されたことと存じます。,グループ分けには、さぞ苦心なさったでしょうね。,グルーブ分けには、さぞ悩んだことでしょうね。,グループ分けには、結構悩んだよね。,アイデア,工夫
こちらの新製品、随分、工夫された事と存じます。,この新製品、ずいぶん、工夫なさいましたね。,この新製品、随分、工夫しましたね。,この新製品、すごく考えたね。,アイデア,工夫
曇らないフロントガラスを、御考案されたそうですね。,曇らないフロントガラスを、ご考案になったそうですね。,曇らないフロントガラスを、御考えになったそうですね。,曇らないフロントガラスを、考えたんだね。,アイデア,工夫
社長が、ナノ・ウォーターを御考案なさったのでしょうか？,社長が、ナノ・ウォータ—を考案なさったんですか？,社長が、ナノ・ウォーターを考案されたのですか？,社長が、ナノ・ウォーターを考えたの？,アイデア,工夫
宇宙戦争が舞台とは、何とも壮大な御構想でございますね。,宇宙戦争が舞台とは、何とも壮大なご構想ですね。,宇宙戦争が舞台とは、何とも壮大な構想ですね。,宇宙戦争が舞台とは、すごくスケールが大きいね。,アイデア,工夫
映画での町興しを御構想なさったのは、先生でございますね。,映画での町興しを構想なさったのは、先生だそうですね。,映画での町興しを構想されたのは、先生だそうですね。,映画での町興しを考えたのは、先生なんだって。,アイデア,工夫
それは素晴らしい御着眼でございますね。,それは素晴らしいご着眼ですね。,それは素晴らしい着眼ですね。,それはすごいところに目を付けたね。,アイデア,工夫
人の気が付かないところに御着眼なさるのは、素晴らしいと存じます。,人の気がつかない所に着眼なさるのは、さすがですね。,人の気が付かないところに着眼するのは、さすがですね。,人の気付かないところに目を向けるのはさすがだね。,アイデア,工夫
この一局は、勝負所の御着想が素晴らしいと存じます。,この一局は、勝負所のご着想が素晴らしいのです。,この一局は、勝負所の着想が素晴らしいです。,この一局は、勝負所がすごいね。,アイデア,工夫
そんな斬新な御着想なさるのは、貴殿しかいらっしゃいません。,そんな斬新な着想なさるのは、あなたの他にいませんよ。,そんな斬新な着想なさるのは、あなたの他にいませんよ。,そんな斬新な事を考えるのは、君しかいないね。,アイデア,工夫
貴殿はいつも素晴らしい御発想をお持ちで、感銘致します。,あなたはいつもユニークな発想をなさるから、驚きです。,あなたはいつもユニークな発想をされるから驚きです。,君はいつもユニークな考えを持ってるからビックリするよ。,アイデア,工夫
土に溶ける新物質を御発明されたと存じます。,土に溶ける新物質を発明なさったそうですね。,土に溶ける新物質を発明されたそうですね。,土に溶ける新物質を発明したんだってね。,アイデア,工夫
近々、またお目にかからせて頂きます。,近々、またお会いしましょう。,近々、またお会いしましょう。,近いうちに、また会おうね。,会う,
宜しければ、本日中にお目にかからせて頂けませんでしょうか？,ぜひとも、本日中にお会いしたいのですが。,是非、本日中にお会いしたいのですが。,よければ、今日会える？,会う,
次にお目にかかる日を楽しみにしております。,次にお会いできる日を楽しみにしております。,次にお会いできる日を楽しみにしております。,また会えるのを楽しみにしてるね。,会う,
またいつでも、お目にかかれます。,またいつでも、お会いになれますよ。,またいつでも、お会いになれますよ。,また、いつでも会えるよ。,会う,
御子息にお会いできる日が待ち遠しい事と存じます。,息子さんに会われる日が待ち遠しいですね。,息子さんにお会いできる日が待ち遠しいですね。,息子に会える日が待ち遠しいね。,会う,
あれ以来、長い事お目にかかっておりません。,あれ以来、長いことお目にかかってませんね。,あれ以来、長い事お目にかかっていませんね。,ずっと見てないね。,会う,
翌日、御挨拶に伺います。堅苦しい御挨拶は結構でございます。,明日、ご挨拶に伺います。 堅苦しいご挨拶は抜きにしましょう。,明日、御挨拶に伺います。堅苦しい御挨拶は結構です。,明日、あいさつに行くね。気楽に会おう。,会う,
それでは、会長が一言、御挨拶申し上げます。,それでは、会長が一言、ご挨拶申しあげます。,それでは、会長が一言、御挨拶させて頂きます。,じゃ、会長から挨拶するね。,会う,
先生に、御挨拶なさいましたか？,先生に、ご挨拶なさいましたか？,先生に、御挨拶しましたか？,先生に挨拶した？,会う,
あちら様が会釈なさってますが、お知り合いでございますか？,あちら様が会釈なさってますが、お知り合いですか？,あちら様が会釈されてますが、お知り合いですか？,あの人が会釈してるけど、知ってる人？,会う,
今貴殿にお辞儀なさった方は、どなたでございますか？,今あなたにお辞儀なさった方は、どなたですか？,今あなたにお辞儀をした方は、どなたですか？,今君にお辞儀をした人は、誰？,会う,
十年ぶりの御再会でございますか？,十年ぶりのご再会なんですって？,十年ぶりの再会なんですって？,十年ぶりに会ったの？,会う,
三社祭りで偶然に御再会されたのでございますか？,三社祭りで偶然に再会なさったんですか？,三社祭りで偶然に再会されたのですか？,三社祭りでばったり会ったの？,会う,
今回が初めての御対面でございますか？,今回が初めてのご対面ですか？,今回が初めての御対面ですか？,今回初めて会ったの？,会う,
十年越しの宿敵と御対面なさった御感想は？,十年越しの宿敵と対面なさったご感想は？,十年越しの宿敵と対面された御感想は？,十年越しの宿敵と会ってどうだった？,会う,
お初にお目にかかります。,お初にお目にかかります。,初めてお会いします。,初対面だね。,会う,初対面
初めてお目にかかります、西方と申します。,初めまして、西方と申します。,初めまして、西方と言います。,どーも、西方です。,会う,初対面
お目にかかる事ができ光栄でございます。,お目にかかれて光栄です。,お会いできて光栄です。,会えて嬉しいよ。,会う,初対面
先生には、以前お目にかかった事がございます。,先生には、以 お目にかかったことがあります。,先生には、以前お会いした事があります。,先生には、前会ったよ。,会う,初対面
いつも、御電話ばかりで大変恐縮です。,いつも、お電話ばかりで失礼しております。,いつも、御電話ばかりで失礼します。,いつも、電話ばかりでごめんね。,会う,初対面
御噂は、かねがね伺っておりました。,お噂は、かねがね伺っておりました。,御噂は、今まで伺っていました。,噂は前から聞いてたよ。,会う,初対面
申し遅れましたが、叔父の坂本と申します。,申し遅れましたが、叔父の坂本と申します。,遅れましたが、叔父の坂本です。,遅れたけど、叔父の坂本だ。,会う,初対面
御挨拶が後回しになりまして、大変恐縮です。,ご挨拶が後回しになりまして、失礼いたしました。,御挨拶が後回しになりまして、失礼しました。,挨拶が遅れてごめんね。,会う,初対面
御名刺を頂戴できますでしょうか？,お名刺を頂戴できますか？,御名刺を戴けますか？,名刺ある？,会う,初対面
大変貴重な御名前でいらっしゃいますね、何とお読みすれば宜しいでしょうか？,珍しいお名前ですね、何とお読みするのですか？,珍しい御名前ですね、何とお読みするのですか？,珍しい名前だね、なんて読むの？,会う,初対面
今後とも、宜しくお願い申し上げます。,今後とも、よろしくお願いいたします。,今後とも、宜しくお願いします。,これからよろしくね。,会う,初対面
どうぞ、以後お見知り置きを、お願い申し上げます。,どうぞ、以後お見知り置きを、お願いいたします。,どうぞ、以後お見知り置きを、お願いします。,これから仲良くしてね。,会う,初対面
今後ともお付き合いの程、宜しくお願い申し上げます。,今後ともお付き合いのほど、よろしくお願いいたします。,今後ともお付き合いの程、宜しくお願いします。,これからも仲良くやっていこうね。,会う,初対面
貴重な御縁を、宜しくお願い申し上げます。,これをご縁に、よろしくお願いいたします。,これを御縁に、宜しくお願いします。,この縁をよろしくね。,会う,初対面
ようやく大使にお目通りが叶いました。,ようやく大使にお目通りが叶いました。,ようやく大使に会う事ができました。,やっと大使に会えた。,会う,初対面
実は、貴殿にお会いになって頂きたい方がおります。,実は、あなたにお会わせしたい人がいるのよ。,実は、あなたに会ってもらいたい人がいます。,実は、君に会って欲しい人がいる。,会う,紹介する
御二人が御会いになられるのは、お初でございますか？,お二人が顔をお合わせになるのは、初めてですか？,御二人が顔を合わせるのは、初めてですか？,2人が会うのは初めて？,会う,紹介する
宜しければ私に婿様のお手伝いをさせて頂けませんでしょうか？,私がお婿さんんを、お世話しましょうか。,良ければ私がお婿さんの、お手伝いをしますか？,婿さんの手伝いしようか？,会う,紹介する
貴殿の御仲介のおかげで、お目にかかる事ができました。,あなたのご仲介のおかげで、お会することができました。,あなたの御仲介のおかげで、お会いする事ができました。,君のおかげで会う事ができたよ。,会う,紹介する
いつぞやお話させて頂いた館長殿に、御引き合わせ存じます。,いつぞやお話しした館長さんに、お引き合わせしましょう。,前にお話しした館長さんに、御引き合わせしましょう。,前に話した館長に会わせてあげるよ。,会う,紹介する
どうぞ、お引き回し下さいませ。存分に、お引き回し下さいませ。,よろしく、お引き回しください。 存分に、お引き回しください。,どうぞ、お引き回し下さい。存分にお引き回し下さい。,まわしていいよ。いっぱいまわしていーよ。,会う,紹介する
お見合いも二十回目となると、退屈なさる事でしょう？,お見合いも二十回目となると、飽きるでしょ？,お見合いも二十回目となると、飽きますか？,お見合いも二十回目だと、退屈でしょ？,会う,紹介する
よく写っていらっしゃいます、お見合い写真になさったらいかがでしょうか？,よく写ってるわ、お見合い写真になさったら？,よく写ってます、お見合い写真にいかがですか？,よく写ってるからお見合い写真にどう？,会う,紹介する
私、先日御紹介いただいた西方と申し上げます。,私、先日ご紹介いただいた西方と申す者です。,私、先日御紹介いただいた西方です。,私は前に紹介してもらった西方だ。,会う,紹介する
さようでございますか、そちらの道のエキスパートを御紹介致します。,それでしたら、その道のエキスパートをご紹介しましょう。,それでしたら、その道のエキスパートを御紹介します。,それだったら、詳しい人を教えてあげる。,会う,紹介する
人を御紹介なさる時は、よくお考えになった方が宜しいかと存じます。,人を紹介なさる時は、よくお考えになった方がいいですよ。,人を紹介する時は、よくお考えになった方がいいと思います。,人を紹介する時は、考えてからの方がいいよ。,会う,紹介する
大変光栄です、一度お目にかかりたいと思っておりました。,まあ、嬉しい、 一度ぜひお会いしたいと思っておりました。,まあ、嬉しいです。一度ぜひお会いしたいと思っていました。,嬉しい、1回会いたいと思っていたんだ。,会う,紹介する
近々、お目にかかりたいと存じます。（手紙文）,近々、お目にかかりたいと存じます。（手紙文）,近々、お目にかかりたいです。（手紙文）,近いうちに、会いたいと思っている。,会う,紹介する
奥方様に御目文字を賜りたく存じます。（手紙文）,奥方様にお目文字を賜りたいのですが 。（手紙文）,奥方様にお会いしたいと思っております。（手紙文）,奥方様に会いたい。（手紙文）,会う,紹介する
ぜひ一度、奥様の御尊顔を拝したいと存じます。（手紙文）,ぜひ一度、奥様のご尊顔を拝したいと存じます。（手紙文）,ぜひ一度、奥様のお顔を拝見させて頂きたいです。（手紙文）,今度、奥さんの顔を見せて。（手紙文）,会う,紹介する
,,,,,
,,,,,
まあ、ふくよかで可愛い赤ちゃんでいらっしゃいますね。,まあ、可愛い赤ちゃんね、ぽっちやりしてて。,まあ、ぽっちゃりして可愛い赤ちゃんですね。,まあ、ぽっちゃりして可愛い赤ちゃんだね。,赤ちゃん,お産
お食い初めに、お父様をお呼びになったらいかがでしょうか？,お食い初めに、お父様をお呼びになったら？,お食い初めに、お父さんを呼んでみたらどうですか？,お食い初めに、お父さんを呼んでみたらどうかな？,赤ちゃん,お産
ご出産のお祝いに、おくるみをお贈りさせていただきます。,出産祝いに、おくるみをお贈りするわね。,出産祝いに、おくるみを贈らせてもらうね。,出産祝いに、おくるみを贈るね。,赤ちゃん,お産
何事もなく、お七夜をお迎えすることができました。,何事もなく、お七夜を迎えることができました。,何事もなく、お七夜を迎えました。,何事もなく、お七夜を迎えられた。,赤ちゃん,お産
赤ちゃんが、おしゃぶりを落とされたようですよ。,赤ちゃんが、おしやぶりを落としましたよ。,赤ちゃんが、おしゃぶりを落としましたよ。,赤ちゃんが、おしゃぶりを落としたよ。,赤ちゃん,お産
まあ、玉のような赤ちゃんでいらっしゃいますね。,まあ、玉のような赤ちゃんですこと。,まあ、玉のようなあかちゃんですね。,まあ、玉のような赤ちゃんだね。,赤ちゃん,お産
三人もお産みになっておられるので、赤ちゃんのあやし方がお上手でいらっしゃいますね。,三人もお産みになってるから、赤ちゃんのあやし方がお上手ね。,三人も産んでるから、赤ちゃんのあやし方が上手ですね。,三人も産んでるから、赤ちゃんのあやし方が上手だね。,赤ちゃん,お産
お産がお軽く済まれたようで、よろしかったですね。,良かったですね、お産が軽く済んで。,お産が軽く済んで、よかったですね。,お産が軽く済んで、よかったね。,赤ちゃん,お産
娘様が、おめでたでいらっしゃるそうですね。,娘さん、おめでただそうですね。,娘さん、おめでたなんですね。,娘さん、おめでただそうだね。,赤ちゃん,お産
ご安産でいらしたそうで、よろしかったです。,ご安産だったそうで、良かったわね。,安産だったそうで、よかったですね。,安産だったそうで、良かったね。,赤ちゃん,お産
